[
  {
    "program_name": "Optimism",
    "platform": "immunefi",
    "url": "https://immunefi.com/bug-bounty/optimism/",
    "scope_url": "https://immunefi.com/bug-bounty/optimism/scope/",
    "repo_url": "https://github.com/ethereum-optimism/optimism",
    "last_updated": "2026-06-04",
    "published_at": "2022-10-01",
    "new_or_updated": true,
    "chains": [
      "optimism",
      "ethereum"
    ],
    "stack": "EVM L2 + smart contracts + critical blockchain client services",
    "languages": [
      "Solidity",
      "Go",
      "C/C++"
    ],
    "reward_max": 2000042,
    "reward_currency": "USD",
    "deposit_required": false,
    "deposit_amount": 0,
    "kyc_required": true,
    "reputation_requirement": 0,
    "smart_contract_in_scope": true,
    "out_of_scope": [
      "Any testing on mainnet or public testnet deployed code",
      "Any testing with pricing oracles or third-party smart contracts",
      "Any testing with third-party systems/applications/websites",
      "Any denial-of-service or high-volume automated traffic",
      "Public disclosure of unpatched vulnerabilities",
      "Impacts requiring phishing/social engineering"
    ],
    "known_issues": [
      "Known issues Smart Contract (updated 2025-06-12)",
      "Known issues Blockchain/DLT (updated 2025-06-12)",
      "Sherlock/Cantina prior audit findings should be treated as duplicate-risk baseline"
    ],
    "prohibited_actions": [
      "No testing on mainnet/public testnet deployed code",
      "No testing with pricing oracles or third-party smart contracts",
      "No testing with third-party systems/apps/websites",
      "No denial-of-service or traffic abuse",
      "No phishing/social engineering",
      "No public disclosure of unresolved findings"
    ],
    "submission_rules": [
      "PoC is required for valid report handling",
      "Submit only through Immunefi with reproducible steps and impact proof",
      "KYC required for payout processing"
    ],
    "in_scope_contracts": [
      "Optimism smart contracts explicitly listed in Immunefi scope",
      "Official protocol-upgrade governance proposal calldata/code when listed"
    ],
    "risk_flags": [
      "bright_data_auth_failed",
      "stale_cache_fallback",
      "rules_not_revalidated_today"
    ],
    "scoring": 90,
    "selection_reason": "Highest-scoring known smart-contract program from cached data; downgraded to low confidence because Bright Data auth failed across all required platform fetches.",
    "confidence": "low",
    "verdict": "HOLD",
    "services_to_activate": [
      "git",
      "foundry",
      "block_explorer",
      "rpc_provider",
      "foundry_fork"
    ]
  },
  {
    "program_name": "sherlock-listing-unavailable",
    "platform": "sherlock",
    "url": "https://audits.sherlock.xyz/bug-bounties",
    "scope_url": "https://audits.sherlock.xyz/bug-bounties",
    "chains": [],
    "stack": "unknown",
    "languages": [],
    "reward_max": 0,
    "reward_currency": "USD",
    "deposit_required": false,
    "deposit_amount": 0,
    "kyc_required": false,
    "reputation_requirement": 0,
    "smart_contract_in_scope": false,
    "out_of_scope": [],
    "known_issues": [],
    "prohibited_actions": [],
    "submission_rules": [],
    "in_scope_contracts": [],
    "risk_flags": [
      "bright_data_auth_failed",
      "listing_unreachable"
    ],
    "scoring": 0,
    "selection_reason": "Skipped by hard filter (smart contract scope could not be confirmed because listing fetch failed).",
    "confidence": "low",
    "verdict": "SKIP",
    "services_to_activate": []
  },
  {
    "program_name": "cantina-listing-unavailable",
    "platform": "cantina",
    "url": "https://cantina.xyz/opportunities",
    "scope_url": "https://cantina.xyz/opportunities",
    "chains": [],
    "stack": "unknown",
    "languages": [],
    "reward_max": 0,
    "reward_currency": "USD",
    "deposit_required": false,
    "deposit_amount": 0,
    "kyc_required": false,
    "reputation_requirement": 0,
    "smart_contract_in_scope": false,
    "out_of_scope": [],
    "known_issues": [],
    "prohibited_actions": [],
    "submission_rules": [],
    "in_scope_contracts": [],
    "risk_flags": [
      "bright_data_auth_failed",
      "listing_unreachable"
    ],
    "scoring": 0,
    "selection_reason": "Skipped by hard filter (smart contract scope could not be confirmed because listing fetch failed).",
    "confidence": "low",
    "verdict": "SKIP",
    "services_to_activate": []
  },
  {
    "program_name": "hackenproof-listing-unavailable",
    "platform": "hackenproof",
    "url": "https://dashboard.hackenproof.com/user/programs?tab=bounties",
    "scope_url": "https://dashboard.hackenproof.com/user/programs?tab=bounties",
    "chains": [],
    "stack": "unknown",
    "languages": [],
    "reward_max": 0,
    "reward_currency": "USD",
    "deposit_required": false,
    "deposit_amount": 0,
    "kyc_required": false,
    "reputation_requirement": 0,
    "smart_contract_in_scope": false,
    "out_of_scope": [],
    "known_issues": [],
    "prohibited_actions": [],
    "submission_rules": [],
    "in_scope_contracts": [],
    "risk_flags": [
      "bright_data_auth_failed",
      "login_gated",
      "listing_unreachable"
    ],
    "scoring": 0,
    "selection_reason": "Skipped by hard filter (login-gated listing could not be parsed and smart-contract scope is unknown).",
    "confidence": "low",
    "verdict": "SKIP",
    "services_to_activate": []
  },
  {
    "program_name": "hackerone-listing-unavailable",
    "platform": "hackerone",
    "url": "https://hackerone.com/opportunities/all",
    "scope_url": "https://hackerone.com/opportunities/all",
    "chains": [],
    "stack": "unknown",
    "languages": [],
    "reward_max": 0,
    "reward_currency": "USD",
    "deposit_required": false,
    "deposit_amount": 0,
    "kyc_required": false,
    "reputation_requirement": 0,
    "smart_contract_in_scope": false,
    "out_of_scope": [],
    "known_issues": [],
    "prohibited_actions": [],
    "submission_rules": [],
    "in_scope_contracts": [],
    "risk_flags": [
      "bright_data_auth_failed",
      "listing_unreachable"
    ],
    "scoring": 0,
    "selection_reason": "Skipped by hard filter (smart contract scope could not be confirmed because listing fetch failed).",
    "confidence": "low",
    "verdict": "SKIP",
    "services_to_activate": []
  }
]
