[
  {
    "program_name": "Optimism",
    "platform": "immunefi",
    "url": "https://immunefi.com/bug-bounty/optimism/",
    "scope_url": "https://immunefi.com/bug-bounty/optimism/scope/",
    "repo_url": "https://github.com/ethereum-optimism/optimism",
    "last_updated": "2026-06-04",
    "published_at": "2026-06-04",
    "new_or_updated": true,
    "chains": [
      "optimism",
      "ethereum"
    ],
    "stack": "EVM L2 + smart contracts + critical blockchain client services",
    "languages": [
      "Solidity",
      "Go",
      "C/C++"
    ],
    "reward_max": 2000042,
    "reward_currency": "USD",
    "deposit_required": false,
    "deposit_amount": 0,
    "kyc_required": true,
    "reputation_requirement": 0,
    "smart_contract_in_scope": true,
    "out_of_scope": [
      "Any testing on mainnet or public testnet deployed code",
      "Any testing with pricing oracles or third-party smart contracts",
      "Any testing with third-party systems/applications/websites",
      "Any denial-of-service or high-volume automated traffic",
      "Public disclosure of unpatched vulnerabilities",
      "Impacts requiring phishing/social engineering"
    ],
    "known_issues": [
      "Known issues Smart Contract (updated 2025-06-12)",
      "Known issues Blockchain/DLT (updated 2025-06-12)",
      "Sherlock/Cantina prior audit findings are duplicate-risk baseline"
    ],
    "prohibited_actions": [
      "Mainnet/public testnet testing",
      "Third-party system interaction",
      "DoS or traffic abuse",
      "Phishing/social engineering",
      "Public disclosure of unresolved findings"
    ],
    "submission_rules": [
      "PoC required for valid report handling",
      "Submit through Immunefi with reproducible steps and impact proof",
      "Keep report confidential until coordinated resolution",
      "KYC required for payout"
    ],
    "in_scope_contracts": [
      "Optimism smart contracts and explicitly listed scope assets",
      "Critical blockchain client services in scope when listed (op-node, op-geth)"
    ],
    "risk_flags": [
      "bright_data_auth_401_all_platforms",
      "confidence_low_due_stale_cached_record",
      "sherlock_cantina_prior_audit_duplicate_risk"
    ],
    "scoring": 90,
    "selection_reason": "Highest cached eligible smart-contract program after configured weights (+30 recency, +25 reward, +20 no deposit, +15 SC scope). Bright Data fetches returned HTTP 401 across all configured platforms, forcing low-confidence HOLD.",
    "confidence": "low",
    "verdict": "HOLD",
    "services_to_activate": [
      "git",
      "foundry",
      "block_explorer",
      "rpc_provider",
      "foundry_fork"
    ]
  },
  {
    "program_name": "Sherlock listings (unavailable)",
    "platform": "sherlock",
    "url": "https://audits.sherlock.xyz/bug-bounties",
    "scope_url": "https://audits.sherlock.xyz/bug-bounties",
    "repo_url": "https://audits.sherlock.xyz/bug-bounties",
    "last_updated": "2026-06-18",
    "published_at": "2026-06-18",
    "new_or_updated": false,
    "chains": [],
    "stack": "unknown",
    "languages": [],
    "reward_max": 0,
    "reward_currency": "USD",
    "deposit_required": false,
    "deposit_amount": 0,
    "kyc_required": false,
    "reputation_requirement": 0,
    "smart_contract_in_scope": false,
    "out_of_scope": [],
    "known_issues": [],
    "prohibited_actions": [],
    "submission_rules": [],
    "in_scope_contracts": [],
    "risk_flags": [
      "bright_data_auth_401",
      "rules_unparsed",
      "listing_fetch_failed"
    ],
    "scoring": 0,
    "selection_reason": "Skipped: listing could not be fetched due to Bright Data authentication failure (HTTP 401).",
    "confidence": "low",
    "verdict": "SKIP",
    "services_to_activate": []
  },
  {
    "program_name": "Cantina listings (unavailable)",
    "platform": "cantina",
    "url": "https://cantina.xyz/opportunities",
    "scope_url": "https://cantina.xyz/opportunities",
    "repo_url": "https://cantina.xyz/opportunities",
    "last_updated": "2026-06-18",
    "published_at": "2026-06-18",
    "new_or_updated": false,
    "chains": [],
    "stack": "unknown",
    "languages": [],
    "reward_max": 0,
    "reward_currency": "USD",
    "deposit_required": false,
    "deposit_amount": 0,
    "kyc_required": false,
    "reputation_requirement": 0,
    "smart_contract_in_scope": false,
    "out_of_scope": [],
    "known_issues": [],
    "prohibited_actions": [],
    "submission_rules": [],
    "in_scope_contracts": [],
    "risk_flags": [
      "bright_data_auth_401",
      "rules_unparsed",
      "listing_fetch_failed"
    ],
    "scoring": 0,
    "selection_reason": "Skipped: listing could not be fetched due to Bright Data authentication failure (HTTP 401).",
    "confidence": "low",
    "verdict": "SKIP",
    "services_to_activate": []
  },
  {
    "program_name": "HackenProof listings (unavailable)",
    "platform": "hackenproof",
    "url": "https://dashboard.hackenproof.com/user/programs?tab=bounties",
    "scope_url": "https://dashboard.hackenproof.com/user/programs?tab=bounties",
    "repo_url": "https://dashboard.hackenproof.com/user/programs?tab=bounties",
    "last_updated": "2026-06-18",
    "published_at": "2026-06-18",
    "new_or_updated": false,
    "chains": [],
    "stack": "unknown",
    "languages": [],
    "reward_max": 0,
    "reward_currency": "USD",
    "deposit_required": false,
    "deposit_amount": 0,
    "kyc_required": false,
    "reputation_requirement": 0,
    "smart_contract_in_scope": false,
    "out_of_scope": [],
    "known_issues": [],
    "prohibited_actions": [],
    "submission_rules": [],
    "in_scope_contracts": [],
    "risk_flags": [
      "bright_data_auth_401",
      "login_gated",
      "rules_unparsed",
      "listing_fetch_failed"
    ],
    "scoring": 0,
    "selection_reason": "Skipped: login-gated listing could not be fetched due to Bright Data authentication failure (HTTP 401).",
    "confidence": "low",
    "verdict": "SKIP",
    "services_to_activate": []
  },
  {
    "program_name": "HackerOne listings (unavailable)",
    "platform": "hackerone",
    "url": "https://hackerone.com/opportunities/all",
    "scope_url": "https://hackerone.com/opportunities/all",
    "repo_url": "https://hackerone.com/opportunities/all",
    "last_updated": "2026-06-18",
    "published_at": "2026-06-18",
    "new_or_updated": false,
    "chains": [],
    "stack": "unknown",
    "languages": [],
    "reward_max": 0,
    "reward_currency": "USD",
    "deposit_required": false,
    "deposit_amount": 0,
    "kyc_required": false,
    "reputation_requirement": 0,
    "smart_contract_in_scope": false,
    "out_of_scope": [],
    "known_issues": [],
    "prohibited_actions": [],
    "submission_rules": [],
    "in_scope_contracts": [],
    "risk_flags": [
      "bright_data_auth_401",
      "rules_unparsed",
      "listing_fetch_failed"
    ],
    "scoring": 0,
    "selection_reason": "Skipped: listing could not be fetched due to Bright Data authentication failure (HTTP 401).",
    "confidence": "low",
    "verdict": "SKIP",
    "services_to_activate": []
  }
]
